{
  "$schema": "https://triesap.github.io/leptos_ui_kit/schema/0.9.0-alpha/registry-item.schema.json",
  "schemaVersion": "0.9.0-alpha",
  "name": "menu",
  "kind": "ui",
  "version": "0.9.0-alpha",
  "title": "Menu",
  "description": "A primitive-backed Leptos menu component family.",
  "leptos": {
    "version": "0.9.0-alpha",
    "routerVersion": "0.9.0-alpha",
    "renderMode": "csr"
  },
  "accessibility": {
    "behaviors": [
      {
        "name": "menu-button-semantics",
        "required": true
      },
      {
        "name": "escape-and-outside-dismissal",
        "required": true
      },
      {
        "name": "roving-tabindex",
        "required": true
      },
      {
        "name": "checked-item-state",
        "required": true
      },
      {
        "name": "controlled-checked-item-state",
        "required": true
      },
      {
        "name": "typeahead",
        "required": true
      },
      {
        "name": "return-focus",
        "required": true
      },
      {
        "name": "viewport-aware-placement",
        "required": true
      }
    ],
    "notes": []
  },
  "files": [
    {
      "source": "ui/menu/mod.rs",
      "target": {
        "kind": "ui",
        "path": "menu/mod.rs",
        "exports": [
          "MenuContent",
          "MenuContentAlign",
          "MenuContentSide",
          "MenuDirection",
          "MenuItem",
          "MenuItemIndicator",
          "MenuItemKind",
          "MenuLoop",
          "MenuRadioItem",
          "MenuRoot",
          "MenuTrigger"
        ]
      }
    },
    {
      "source": "ui/menu/root.rs",
      "target": {
        "kind": "ui",
        "path": "menu/root.rs",
        "exports": []
      }
    },
    {
      "source": "ui/menu/trigger.rs",
      "target": {
        "kind": "ui",
        "path": "menu/trigger.rs",
        "exports": []
      }
    },
    {
      "source": "ui/menu/content.rs",
      "target": {
        "kind": "ui",
        "path": "menu/content.rs",
        "exports": []
      }
    },
    {
      "source": "ui/menu/item.rs",
      "target": {
        "kind": "ui",
        "path": "menu/item.rs",
        "exports": []
      }
    },
    {
      "source": "ui/menu/radio_item.rs",
      "target": {
        "kind": "ui",
        "path": "menu/radio_item.rs",
        "exports": []
      }
    },
    {
      "source": "ui/menu/item_indicator.rs",
      "target": {
        "kind": "ui",
        "path": "menu/item_indicator.rs",
        "exports": []
      }
    }
  ],
  "styles": [
    {
      "source": "styles/menu.css",
      "target": {
        "kind": "managed-css-block",
        "id": "menu"
      }
    }
  ],
  "registryDependencies": [],
  "cargoPlan": [
    {
      "crate": "leptos",
      "source": {
        "kind": "version",
        "version": "0.9.0-alpha"
      },
      "features": [
        "csr"
      ],
      "required": true
    },
    {
      "crate": "web_ui_primitives",
      "source": {
        "kind": "git",
        "url": "https://github.com/triesap/web_ui_primitives",
        "rev": "4472c5bab985c2dc3333c31bbdf193b24d36a979"
      },
      "features": [
        "leptos"
      ],
      "required": true
    }
  ],
  "extra": {}
}
