{
  "$schema": "https://triesap.github.io/leptos_ui_kit/schema/0.9.0-alpha/registry-item.schema.json",
  "schemaVersion": "0.9.0-alpha",
  "name": "tokens",
  "kind": "foundation",
  "version": "0.9.0-alpha",
  "title": "Semantic Tokens",
  "description": "The shared semantic CSS token foundation for all styled leptos_ui_kit items.",
  "leptos": {
    "version": "0.9.0-alpha",
    "routerVersion": "0.9.0-alpha",
    "renderMode": "csr"
  },
  "accessibility": {
    "behaviors": [],
    "notes": []
  },
  "files": [],
  "styles": [
    {
      "source": "styles/tokens.css",
      "target": {
        "kind": "managed-css-block",
        "id": "tokens"
      }
    }
  ],
  "registryDependencies": [],
  "cargoPlan": [],
  "extra": {
    "themeContractVersion": "1"
  }
}
